{
  "$schema": "../schemas/iteration-diary.schema.json",
  "subtaskId": "SUB-001",
  "sessionId": "abc123-def456-ghi789",
  "status": "completed",
  "summary": "Implemented user registration endpoint with validation and password hashing",
  "timestamp": "2026-01-11T09:45:00Z",
  "milestone": "mvp",
  "taskRef": "TASK-001",
  "iterationNum": 1,
  "keyFindings": [
    "Used bcrypt with cost factor 12 for password hashing",
    "Added email uniqueness constraint at database level"
  ],
  "errors": [],
  "toolCalls": 42,
  "filesChanged": [
    "src/routes/auth.ts",
    "src/services/auth.service.ts",
    "src/db/schema.ts"
  ],
  "duration": 180
}
